<?xml version="1.0" encoding="UTF-8"?>
<!DOCTYPE issues SYSTEM "native.dtd">

<!--
  * sample.xml
  *
  * Copyright (c) 2003-2005 The Public Knowledge Project
  * Distributed under the GNU GPL v2. For full terms see the file docs/COPYING.
  *
  * Sample import document for the OJS 2.x native XML import/export format.
  *
  * $Id$
  -->

<issues>
 <issue>
  <title>Test Issue</title>
  <access_date>01-01-2001</access_date>
  <section>
   <title>Articles</title>
   <article>
    <title>Jane Doe's Article</title>
    <author>
     <firstname>Jane</firstname>
     <lastname>Doe</lastname>
    </author>
    <htmlgalley>
     <label>HTML</label>
     <file href="mygalley.html" />
     <stylesheet href="mystylesheet.css" />
     <image href="myimage1.png" />
     <image href="myimage2.png" />
    </htmlgalley>
    <galley>
     <label>PDF</label>
     <file href="mygalley.pdf" />
    </galley>
   </article>
  </section>
 </issue>
 <issue>
  <title>Existingjournal Issue</title>
  <open_access/>
  <section>
   <title>Articles</title>
   <article>
    <title>John Doe's Article</title>
    <author>
     <firstname>John</firstname>
     <lastname>Doe</lastname>
    </author>
   </article>
  </section>
 </issue>
</issues>
